,Sentence,Aspect Term,polarity
962,"European stocks hover near 3-week low, Dialog and BHP slump",Dialog,negative
964,Tesco leads FTSE higher on Clubcard bid reports,Tesco PLC,positive
965,Why I'd Buy ARM Holdings plc And BHP Billiton plc Today,ARM Holdings plc,positive
966,Admiral Group posts decline in 2014 earnings,Admiral Group plc,negative
967,"Britain's FTSE bounces back, Mondi and Barratt lead",Mondi,positive
968,UPDATE 3-Barclays sells Italian branches to Mediobanca at a loss,Mediobanca,positive
969,Morrisons finance chief to fill gap as CEO leaves early,Morrisons,neutral
970,Sophos aims to raise $100m in London IPO,Sophos,positive
972,Wolseley share price: Group updates on quarterly performance,Wolseley,neutral
973,Rio Tinto announces long-delayed expansion of Mongolia mine,Rio Tinto,positive
974,Shire rises as dry eye treatment sails through trial,Shire,positive
975,Doubts grow over GlaxoSmithKline's $6 bln capital return plan,GlaxoSmithKline,negative
976,Aviva weighs cash handout after beating profit forecast,Aviva plc,positive
977,Shropshire and Mid Wales trains to be hit again in new strike by Arriva drivers,Arriva,negative
978,Greene King's third quarter sales boosted by festive season,Greene King,positive
979,Big account wins keep ad group WPP at front of pack,WPP,positive
980,Worldpay readies for Â£6bn London float,Worldpay,neutral
981,"CEOs of BPM, UBI meet Italy econ minister as M&A talk heats up",BPM,neutral
982,"Should You Buy Jumbo Yielders British American Tobacco plc, Centrica PLC & John Wood Group PLC?",Centrica PLC,neutral
983,Dyson Wants to Create a Hair Dryer Revolution,Dyson,positive
984,Royal Dutch Shell to Buy BG Group for Nearly $70 Billion,BG Group,positive
985,"EXCLUSIVE-BP, China's CNPC to unveil oil alliance - sources",CNPC,positive
986,CORRECTED-Shire to buy Dyax for about $5.9 bln,Dyax,positive
987,BP set to cut hundreds of jobs at North Sea operations,BP,negative
988,BP's head of exploration Richard Herbert departs,BP,neutral
989,"UPDATE 1-Nomura, RBS must pay $806 mln in mortgage bond case-US judge",Nomura,negative
991,CompaniesRoyal Mail swerves new pricing regulations,Royal Mail,neutral
992,JC Penney Cuts Pension Plan Obligation,JC Penney,neutral
993,Domino's Pizza worker sacked after crude slur aimed at customer on order screen,Domino's Pizza Group plc,negative
994,"UPDATE 2-AB InBev launches SAB bid, to sell MillerCoors stake",MillerCoors,neutral
995,Sales boost for new Morrisons chief David Potts as Tesco turnaround stalls,Morrisons,positive
996,France raises concerns over proposed LSE-Deutsche Boerse deal,Deutsche Boerse,negative
997,Genel Shares Plunge After Tony Hayward's Oil Explorer Cuts Crude Reserves at Core Field,Genel,negative
998,LSE-Deutsche Boerse merger would signal end to exchange mega-deals,Deutsche Boerse,neutral
999,Sports Direct boss Mike Ashley summoned to Westminster for questioning over the treatment of workers,Sports Direct,negative
1000,Diageo receives reports from United Spirits on financial irregularities involving ...,Diageo,negative
1001,Industry NewsWood Group wins multi-million dollar contract with BP,BP,positive
1002,"Centrica extends gas deals with Gazprom, Statoil",Centrica PLC,neutral
1003,Legal & General arm buys 50 pct stake in MediaCityUK in Manchester,MediaCityUK,positive
1004,Sainsbury's pressed to raise bid for Home Retail Group,Home Retail Group,positive
1005,"Buffett's Berkshire builds Deere stake, dumps Exxon",ExxonMobil,negative
1006,"Aldi and Lidl expansion plans speed ahead as Tesco, Sainsbury's, Morrisons ...",Aldi,positive
1007,Analysis - Copper market may get a 2003-style supply shock from Glencore closures,Glencore,negative
1008,Tesco share price: Korean currency slide may hit Homeplus sale plans,Tesco PLC,negative
1009,AstraZeneca cancer drug may not be so fast getting to market,AstraZeneca,negative
1010,Tullow Oil Suspends Dividend Amid Oil Price Fall,Tullow Oil,negative
1011,UPDATE 3-Barclays sells Italian branches to Mediobanca at a loss,Barclays,negative
1012,Diageo Shares Surge on Report of Possible Takeover by Lemann,Lemann,positive
1013,"Aviva, Friends Life top forecasts ahead of 5.6 billion pound merger",Aviva plc,neutral
1014,Friends Life lifts profits 38% and hikes divi ahead of proposed Aviva takeover,Friends Life,positive
1015,Centrica suffers protest from shareholders over pay,Centrica PLC,negative
1016,Google Fiber to buy Webpass for big city Internet service,Google,positive
1017,Is It Worth Investing In Tesco PLC And Prudential plc Now?,Prudential,neutral
1018,2 Turnaround Buys For 2016? BHP Billiton plc And Home Retail Group Plc,Home Retail Group,positive
1019,Halfords appoints Jonny Mason as new CFO,Halfords,neutral
1021,Experian says receives class actions related to T-Mobile breach,Experian,negative
1023,IAG closes in on Aer Lingus with increased offer,Aer Lingus,positive
1024,GKN to buy Fokker Technologies for 706 mln euros,Fokker Technologies,positive
1025,UPDATE 1-Shire steps up drive to get Baxalta talking after $30 bln bid,Baxalta,positive
1026,Pearson in Talks to Sell Its Stake in the Economist Group,Pearson,positive
1027,CompaniesTesco sheds Harris & Hoole coffee shops,Tesco,positive
1028,REFILE-BP agrees UK gas pipeline stake sale to infrastructur,BP,positive
1029,"BHP Billiton slashes dividend, posts $5.67 billion net loss",BHP Billiton,negative
1030,"StanChart capital raising would be ""major surprise"" -investor Aberdeen",Standard Chartered PLC,neutral
1031,Why I Would Put J Sainsbury plc In My Trolley Before Wm Morrison Supermarkets ...,Wm Morrison,negative
1032,Glaxo Sees Hope for Respiratory Drugs as Earnings Beat Estimates,Glaxo,positive
1033,Peroni and Grolsch put up for sale as AB InBev plans acquisition of SABMiller,SABMiller,positive
1035,Direct Line rings up higher profit,Direct Line Insurance Group PLC,positive
1036,Jim Armitage: Barclays boss Jes Staley steps up to the plate with post-Leave positivity,Barclays,neutral
1037,AstraZeneca sells rights to anaesthetics to South Africa's Aspen,AstraZeneca,positive
1038,GE to Sell Majority Stake in Bank BPH's Core Bank to Alior Bank,GE,positive
1039,StanChart and RBS struggle in Bank of England stress tests,Royal Bank of Scotland Group plc,negative
1040,Antofagasta Sees Lower Cash Costs In 2015 - Quick Facts,Antofagasta,positive
1041,NPS prospects dependent on drug approval,NPS,neutral
1042,Priceline's stock jumps to new high for the year after Barclays upgrade,Priceline,positive
1043,Tesco leads leap in FTSE 100; Marks & Spencer drops,Tesco PLC,positive
1044,Tesco UK personnel director quits supermarket,Tesco PLC,negative
1045,Royal Bank of Scotland fortunes ebbed and flowed under 3 chiefs,Royal Bank of Scotland Group plc,neutral
1046,Exxon Beaumont CDU overhaul to be slowed by accident: sources,ExxonMobil,negative
1047,TalkTalk hires BAE Systems to investigate cyber attack,TalkTalk,neutral
1048,Valeant Said to Name New CEO With Pearson Still Hospitalized,Valeant Pharmaceuticals International,neutral
1049,ITV to pursue takeover of Canada's Entertainment One: Bloomberg,Entertainment One,positive
1051,Rio Approves $5.3 Billion Oyu Tolgoi Copper Mine Expansion,Rio Tinto,positive
1052,Weir Group sees continued fall in orders from oil and gas business,Weir Group,negative
1053,New BG Group CEO Helge Lund Starts Earlier Than Expected,BG Group,neutral
1054,"BHP, Residents Brace as Cyclone Stan Nears Australian Coast",BHP,neutral
1055,Glaxo's ViiV Healthcare Signs China Manufacturing Deal With Desano,Glaxo,positive
1056,"Barclays brands financier Amanda Staveley's $1bn claim as ""misconceived""",Barclays,negative
1057,"GlaxoSmithKline rebound gathering pace, says outgoing CEO",GlaxoSmithKline,positive
1058,AB InBev to sell more SAB assets as seeks EU deal approval,SABMiller,neutral
1060,Morrisons store closures: 900 jobs to go as 11 branches are closed due to ...,Morrissons,negative
1061,BP chairman defends CEO Bob Dudley's pay increase,BP,neutral
1062,Profits Fall 25% At Standard Chartered PLC: Should You Buy Or Sell?,Standard Chartered PLC,negative
1063,SAB's Chairman Digs In With Board Divided on InBev Offer,SABMiller,neutral
1064,Aviva Fined $27 Million by U.K. Regulator Over Fee Failings,Aviva plc,negative
1065,"Whitbread Profit Up As Sales Continue To Rise, Looking For New CEO",Whitbread,positive
1066,Persimmon shares nudge higher as housebuilder sees strong 2014,Persimmon,positive
1067,UPDATE 1-BG Group's record output limits oil price fallout,BG Group,neutral
1068,Standard Life share price: Group gets approval to hike stake in India JV,Standard Life,positive
1069,Tesco Mobile is offering you cash back in exchange for looking at ads,Tesco,neutral
1070,"Wolseley profit up 18%, warns on revenue growth",Wolseley,positive
1071,ITV share price: Group mulls takeover of Canada's Entertainment One,Entertainment One,positive
1072,Blueprint Receives FDA Nod To Proceed With Clinical Trials For 2 Drug ...,Blueprint,positive
1073,SABMiller buys Meantime to quench thirst for craft beer,SABMiller,positive
1074,"Irish Said Chasing Standard Chartered, RBS as Brexit Vote Nears",Royal Bank of Scotland Group plc,neutral
1075,"After Barclays and Bank of America, Citigroup has blockchain in sight",Barclays,neutral
1076,US says HSBC must do more to improve compliance,HSBC,negative
1077,Carnival Corporation and China Merchants Group Sign Memo of Understanding ...,China Merchants Group,neutral
1078,Staley to face challenges at Barclays,Barclays,negative
1079,GSK aims to file up to 20 new drugs for approval by 2020,GSK,positive
1080,British American Tobacco accused of bribing senior politicians to sabotage ...,British American Tobacco plc,negative
1081,BT finance director Tony Chanmugam to step down,BT Group,neutral
1082,AstraZeneca to cut costs but stays silent on M&A talk,AstraZeneca,neutral
1084,Barclays Not Convinced by Gains in South African Stocks: Chart,Barclays,negative
1085,5 Years After BP Spill: What's Changed in Offshore Drilling,BP,negative
1086,AstraZeneca Explores Potential Deal With Acerta for Cancer Drug,AstraZeneca,positive
1087,Tesco sells half of stake in ecommerce site Lazada to Alibaba for Â£90m,Alibaba,positive
1089,Hargreaves Lansdown share price falls as costs mount - although pensions ...,Hargreaves Lansdown,negative
1090,Meggitt agrees to buy US aerospace component firm for $340 million,Meggitt,positive
1091,TRLPC - CRH backs Lafarge Holcim asset buy with 6.5 bln euro bridge loan,CRH,positive
1092,Bloomberg buys Barclays' benchmarking business,Bloomberg,positive
1093,"Barclays, Deutsche Bank Fight to Lift Profit Just Got Harder",Deutsche Bank,negative
1094,Royal Bank of Scotland chair hints Brexit turmoil will delay government sale,Royal Bank of Scotland Group plc,negative
1095,"Sainsbury's, Asda, Tesco and Morrisons will all cut petrol prices as oil falls ...",Sainsbury's,negative
1097,Shire Sees Baxalta Deal Closing as Expected After New Rules,Baxalta,positive
1098,AstraZeneca heart drug boosted by major clinical trial success,AstraZeneca,positive
1099,Shire share price under pressure after $32bn Baxalta deal,Baxalta,neutral
1101,CompaniesGlencore's annual results beat forecasts,Glencore,positive
1103,Pfizer to cut 120 jobs with closure of Cambridge R&D centre,Pfizer,negative
1104,Sainsbury's says to outperform rivals in tough market,Sainsbury's,positive
1105,Centrica share price: British Gas under fire despite 5% price cut,Centrica PLC,negative
1106,RBI surprises Street; Sensex pares gains after hitting mount 30k,Sensex,negative
1107,"London open: Taylor Wimpey and Ashtead drive markets higher, Barclays falls",Barclays,negative
1108,easyJet leads Britain's FTSE lower as global bond rout resumes,EasyJet,negative
1109,AB InBev to Sell SABMiller Stake in China's Snow Beer,SABMiller,neutral
1110,Merkel's Government Said to Support Deutsche Boerse-LSE Merger,London Stock Exchange Group,positive
1111,Tesco share price closes higher as two more directors leave grocer,Tesco PLC,positive
1112,Tesco sells half of stake in ecommerce site Lazada to Alibaba for Â£90m,Lazada,neutral
1113,UPDATE 5-Barclays Chairman McFarlane axes CEO to speed up strategic change,Barclays,negative
1114,"Berkshire Bought Apple Stake at $99.49 a Share, Filing Shows",Berkshire Hathaway Inc.,neutral
1115,Sainsbury CFO Rogers to Replace Home Retail CEO Walden,Sainsbury's,neutral
1117,Copper Prices up on Glencore Cuts to Zinc Supply,Glencore,positive
1118,WPP's Sir Martin Sorrell is highest-paid FTSE 100 chief executive,WPP,neutral
1119,Meggitt plc Crashes 20% On Profit Warning: Is It Now A Buy?,Meggitt,negative
1121,Passengers rise at EasyJet and Aer Lingus,EasyJet,positive
1122,"Sharm el-Sheikh travel disruption: British Airways, EasyJet, Thomson and ...",British Airways,negative
1124,Prudential Financial quarterly profit rises 64 pct,Prudential Financial,positive
1125,US Seeks Huawei Records on Dealings With Sanctioned Nations,Huawei,negative
1126,Centrica urges policy overhaul as it warns of 'looming gap' in UK energy supplies,Centrica PLC,neutral
1127,UPDATE 1-AstraZeneca potassium drug delayed by manufacturing snag,AstraZeneca,negative
1129,"Oil majors like Royal Dutch Shell, Chevron, BP fail to find reserves to counter ...",Royal Dutch Shell,negative
1130,Four ex-Barclays bankers sentenced for roles in Libor rate-rigging scandal,Barclays,negative
1131,AB InBev to sell more SAB assets as seeks EU deal approval,AB InBev,neutral
1132,Berkshire applies to boost Wells Fargo stake above 10 percent,Berkshire Hathaway Inc.,positive
1133,Tesco leads leap in FTSE 100; Marks & Spencer drops,Marks & Spencer,negative
1134,Balfour Beatty plc Set To Reinstate Dividend (And Rival National Grid plc And Centrica PLC Once More?),Balfour Beatty plc,positive
1135,"UPDATE: CIB, Legal & General Sell Egyptian Life Joint Venture To AXA",CIB,neutral
1136,BG Group appoints new CEO one month early,BG Group,neutral
1137,"FDA panel backs Glaxo asthma drug for adults, not adolescents",Glaxo,positive
1138,Barclays set to name former JPMorgan banker Staley as new CEO,Barclays,neutral
1139,Kingfisher share price slides on cost to implement new strategy,Kingfisher,negative
1140,"CompaniesTravis Perkins lifts dividend, earnings rise 15%",Travis Perkins,positive
1141,Standard Chartered Shifts Emerging-Markets Strategy After Losses,Standard Chartered PLC,negative
1051,Rio Approves $5.3 Billion Oyu Tolgoi Copper Mine Expansion,Rio Tinto,positive
1052,Weir Group sees continued fall in orders from oil and gas business,Weir Group,negative
1053,New BG Group CEO Helge Lund Starts Earlier Than Expected,BG Group,neutral
1054,"BHP, Residents Brace as Cyclone Stan Nears Australian Coast",BHP,neutral
1055,Glaxo's ViiV Healthcare Signs China Manufacturing Deal With Desano,Glaxo,positive
1056,"Barclays brands financier Amanda Staveley's $1bn claim as ""misconceived""",Barclays,negative
1057,"GlaxoSmithKline rebound gathering pace, says outgoing CEO",GlaxoSmithKline,positive
1058,AB InBev to sell more SAB assets as seeks EU deal approval,SABMiller,neutral
1060,Morrisons store closures: 900 jobs to go as 11 branches are closed due to ...,Morrissons,negative
1061,BP chairman defends CEO Bob Dudley's pay increase,BP,neutral
1062,Profits Fall 25% At Standard Chartered PLC: Should You Buy Or Sell?,Standard Chartered PLC,negative
1063,SAB's Chairman Digs In With Board Divided on InBev Offer,SABMiller,neutral
1064,Aviva Fined $27 Million by U.K. Regulator Over Fee Failings,Aviva plc,negative
1065,"Whitbread Profit Up As Sales Continue To Rise, Looking For New CEO",Whitbread,positive
